{"capture_locator":"venues/source-captures/cvpr-2026-reviewer-guidelines.json","capture_sha256":"996e95658f4db4c42944e6eaa851596b6faaa643214a15a48dc50177cad337a1","retrieved_at":"2026-07-28T07:56:49Z","schema_version":"1.0.0","sections":[{"claims":[{"claim_id":"cvpr-2026-main:criterion:sound-contribution","claim_kind":"criterion","excerpt_ids":["technical-contribution","strengths-and-weaknesses","detailed-recommendation-basis"],"projection":{"rule_id":"sound-contribution","statement":"Assess technical soundness and meaningful contribution, grounding the recommendation in a detailed account of strengths and weaknesses."},"projection_basis":"source_bounded_interpretation","support_terms":["sound","contribution"]},{"claim_id":"cvpr-2026-main:criterion:balanced-contribution","claim_kind":"criterion","excerpt_ids":["sota-not-automatic","novelty-impact-performance"],"projection":{"rule_id":"balanced-contribution","statement":"Balance novelty, potential impact, and empirical performance; failure to exceed state of the art is not by itself a rejection reason."},"projection_basis":"source_bounded_interpretation","support_terms":["novelty","impact"]},{"claim_id":"cvpr-2026-main:criterion:repairable-issues","claim_kind":"criterion","excerpt_ids":["minor-repairable"],"projection":{"rule_id":"repairable-issues","statement":"Do not let an easily corrected minor flaw become a rejection reason."},"projection_basis":"source_bounded_interpretation","support_terms":["minor","corrected"]}],"extracted_fact":"CVPR asks reviewers to assess soundness and contribution, balance novelty, potential impact and performance, and avoid rejecting for easily corrected minor flaws.","section_anchor":"how-to-write-good-reviews","source_verification":{"method":"manual_browser_text_comparison","offline_nonclaim":"does_not_attest_live_official_page_truth","semantic_projection_review":"human_release_reviewed","status":"verified","verified_at":"2026-07-28T07:56:49Z"},"verbatim_excerpts":[{"capture_end_byte":54,"capture_occurrence":1,"capture_start_byte":0,"excerpt_id":"technical-contribution","sha256":"ad2f03a12bd2164c4b0437b08ed1b120276ce5c71b0672049b2d47ad358228a4","source_locator":"How to Write Good Reviews > Be Mindful > soundness","text":"technically sound and make a contribution to the field"},{"capture_end_byte":153,"capture_occurrence":1,"capture_start_byte":56,"excerpt_id":"strengths-and-weaknesses","sha256":"c806dbdb403985b32be0537e6e3ad97e52adc3e41bf1bef789532dd61dd8b253","source_locator":"How to Write Good Reviews > Be Detailed > main critique","text":"Your main critique of the paper should be written in terms of a list of strengths and weaknesses."},{"capture_end_byte":300,"capture_occurrence":1,"capture_start_byte":155,"excerpt_id":"detailed-recommendation-basis","sha256":"158575e6a4ce303aee4e82d03e4fe6c62f66710ccd7cff584e684bfa223e4937","source_locator":"How to Write Good Reviews > Be Detailed > recommendation basis","text":"Your detailed review, more than your score, will help the authors, fellow reviewers, and Area Chairs understand the basis for your recommendation"},{"capture_end_byte":451,"capture_occurrence":1,"capture_start_byte":302,"excerpt_id":"sota-not-automatic","sha256":"e5f21693e37f5becac0fd6eec579344f941269f03987f1fcaa4d01c4fd6148c0","source_locator":"How to Write Good Reviews > Be Mindful > state of the art","text":"the fact that a proposed method does not exceed the state-of-the-art accuracy on an existing benchmark dataset is not grounds for rejection by itself"},{"capture_end_byte":543,"capture_occurrence":1,"capture_start_byte":453,"excerpt_id":"novelty-impact-performance","sha256":"f5ff20fb5c1482f058a29e045befbe4f3719a4346f39b21da50a0e30a7a76f51","source_locator":"How to Write Good Reviews > Be Mindful > balance","text":"weigh both the novelty and potential impact of the work alongside the reported performance"},{"capture_end_byte":627,"capture_occurrence":1,"capture_start_byte":545,"excerpt_id":"minor-repairable","sha256":"6654d74ba2e69847d9540002f5a0c9a45b2df38fc6dc4b98410518d2c8327b1c","source_locator":"How to Write Good Reviews > Be Mindful > minor flaws","text":"Minor flaws that can be easily corrected should not be a reason to reject a paper."}]}],"source_id":"cvpr-2026-reviewer-guidelines","title":"CVPR 2026 Reviewer Guidelines","url":"https://cvpr.thecvf.com/Conferences/2026/ReviewerGuidelines"}
