{"capture_locator":"venues/source-captures/tmlr-reviewer-guide.json","capture_sha256":"a31cf4cf4387fa3bd501a4569d4f5c401c6bcb6bcdd5a7f86459c85c39b4882d","retrieved_at":"2026-07-28T07:56:49Z","schema_version":"1.0.0","sections":[{"claims":[{"claim_id":"tmlr-current-general:native_field:claims-supported-answer","claim_kind":"native_field","excerpt_ids":["claims-yes-no"],"projection":{"allowed_labels":["Yes","No"],"anchors":[{"label":"Yes","value":"Yes"},{"label":"No","value":"No"}],"direction":"not_ordered","field_id":"claims-supported-answer","field_type":"categorical","maximum":null,"minimum":null,"role":"reviewer"},"projection_basis":"source_bounded_native_semantics","support_terms":["yes","no"]},{"claim_id":"tmlr-current-general:native_field:audience-interest-answer","claim_kind":"native_field","excerpt_ids":["interest-yes-no"],"projection":{"allowed_labels":["Yes","No"],"anchors":[{"label":"Yes","value":"Yes"},{"label":"No","value":"No"}],"direction":"not_ordered","field_id":"audience-interest-answer","field_type":"categorical","maximum":null,"minimum":null,"role":"reviewer"},"projection_basis":"source_bounded_native_semantics","support_terms":["yes","no"]}],"extracted_fact":"The TMLR reviewer form asks for a Yes or No answer and an explanation for each of the two acceptance criteria.","section_anchor":"review-format","source_verification":{"method":"manual_browser_text_comparison","offline_nonclaim":"does_not_attest_live_official_page_truth","semantic_projection_review":"human_release_reviewed","status":"verified","verified_at":"2026-07-28T07:56:49Z"},"verbatim_excerpts":[{"capture_end_byte":78,"capture_occurrence":1,"capture_start_byte":0,"excerpt_id":"claims-yes-no","sha256":"8d0bdd1f2412582e2fe3b4bd3a1400bc5bd9e8a52b8887e090c763f30fd7a195","source_locator":"Review Format > claims-supported answer","text":"Yes/No answer to this first TMLR decision criteria, along with an explanation."},{"capture_end_byte":159,"capture_occurrence":1,"capture_start_byte":80,"excerpt_id":"interest-yes-no","sha256":"88bbd8e4797814b51fd6b992e6f0bc7e31f8f27ec9c148009907bc106531e26f","source_locator":"Review Format > audience-interest answer","text":"Yes/No answer to this second TMLR decision criteria, along with an explanation."}]},{"claims":[{"claim_id":"tmlr-current-general:native_field:official-recommendation","claim_kind":"native_field","excerpt_ids":["recommendation-labels"],"projection":{"allowed_labels":["accept","leaning accept","leaning reject","reject"],"anchors":[{"label":"accept","value":"accept"},{"label":"leaning accept","value":"leaning accept"},{"label":"leaning reject","value":"leaning reject"},{"label":"reject","value":"reject"}],"direction":"not_ordered","field_id":"official-recommendation","field_type":"categorical","maximum":null,"minimum":null,"role":"reviewer"},"projection_basis":"source_bounded_native_semantics","support_terms":["accept","reject"]}],"extracted_fact":"After discussion, a TMLR reviewer selects one of four categorical decision recommendations.","section_anchor":"official-recommendation","source_verification":{"method":"manual_browser_text_comparison","offline_nonclaim":"does_not_attest_live_official_page_truth","semantic_projection_review":"human_release_reviewed","status":"verified","verified_at":"2026-07-28T07:56:49Z"},"verbatim_excerpts":[{"capture_end_byte":235,"capture_occurrence":1,"capture_start_byte":161,"excerpt_id":"recommendation-labels","sha256":"085230b3573a4e73f093a249db5940927370737e5de2cde5b6b4ba3f9583da78","source_locator":"Official Recommendation > Decision recommendation","text":"Decision recommendation (accept, leaning accept, leaning reject or reject)"}]}],"source_id":"tmlr-reviewer-guide","title":"TMLR Reviewer Guide","url":"https://jmlr.org/tmlr/reviewer-guide.html"}
