{"capture_locator":"venues/source-captures/eccv-2026-ac-guidelines.json","capture_sha256":"4a9f296bcdce4d65d319ae3ab478d236f2207984792697975c3323aed84cbefa","retrieved_at":"2026-07-28T07:56:49Z","schema_version":"1.0.0","sections":[{"claims":[{"claim_id":"eccv-2026-main:native_field:final-justification","claim_kind":"native_field","excerpt_ids":["final-recommendation-context","final-recommendation-justification"],"projection":{"allowed_labels":[],"anchors":[],"direction":"not_applicable","field_id":"final-justification","field_type":"text","maximum":null,"minimum":null,"role":"reviewer"},"projection_basis":"source_bounded_native_semantics","support_terms":["final","justification"]}],"extracted_fact":"ECCV asks reviewers to enter a final recommendation that is consistent with the final justification after discussion.","section_anchor":"final-justification","source_verification":{"method":"manual_browser_text_comparison","offline_nonclaim":"does_not_attest_live_official_page_truth","semantic_projection_review":"human_release_reviewed","status":"verified","verified_at":"2026-07-28T07:56:49Z"},"verbatim_excerpts":[{"capture_end_byte":106,"capture_occurrence":1,"capture_start_byte":0,"excerpt_id":"final-recommendation-context","sha256":"31051b777353b73b4019b86c1517d69ea3667c908eb82ac1530a5b6a86ca5b99","source_locator":"Main Tasks > Ensure all Final Justifications > rebuttal and discussion","text":"comments that reflect reading the rebuttal, the other reviews, and the discussion with the other reviewers"},{"capture_end_byte":218,"capture_occurrence":1,"capture_start_byte":108,"excerpt_id":"final-recommendation-justification","sha256":"e2482f8643fd7e639b3072ee68bb40c8e700a2925b0695563e762552b9ddc6cc","source_locator":"Main Tasks > Ensure all Final Justifications","text":"all reviewers have entered the Final Recommendation and that this is consistent with their Final Justification"}]},{"claims":[{"claim_id":"eccv-2026-main:criterion:meta-review-evidence","claim_kind":"criterion","excerpt_ids":["preliminary-meta-review","contribution-type-meta-review","comments-over-scores","confidence-over-personality"],"projection":{"rule_id":"meta-review-evidence","statement":"Explain how reviews, rebuttal and discussion support the decision, consider the contribution type, and rely on comments rather than mechanically following scores or confidence."},"projection_basis":"source_bounded_interpretation","support_terms":["reviews","rebuttal"]},{"claim_id":"eccv-2026-main:native_field:meta-review","claim_kind":"native_field","excerpt_ids":["preliminary-meta-review","contribution-type-meta-review","comments-over-scores","confidence-over-personality"],"projection":{"allowed_labels":[],"anchors":[],"direction":"not_applicable","field_id":"meta-review","field_type":"text","maximum":null,"minimum":null,"role":"meta_reviewer"},"projection_basis":"source_bounded_native_semantics","support_terms":["meta-review","review"]}],"extracted_fact":"ECCV meta-reviews explain how reviews, rebuttal and discussion support the decision, consider contribution types, and focus on comments rather than scores.","section_anchor":"meta-review","source_verification":{"method":"manual_browser_text_comparison","offline_nonclaim":"does_not_attest_live_official_page_truth","semantic_projection_review":"human_release_reviewed","status":"verified","verified_at":"2026-07-28T07:56:49Z"},"verbatim_excerpts":[{"capture_end_byte":325,"capture_occurrence":1,"capture_start_byte":220,"excerpt_id":"preliminary-meta-review","sha256":"8a6be24cb213542933cc12c086a3bc2aada57b958b1454e9f1edb583b7237352","source_locator":"Main Tasks > Writing preliminary metareviews","text":"Summarize how the reviews, the authors’ rebuttal, and the discussion support your preliminary decision."},{"capture_end_byte":400,"capture_occurrence":1,"capture_start_byte":327,"excerpt_id":"contribution-type-meta-review","sha256":"cb7dea9c42381ff0cc9edc7851bb67e05764f42ea1e7e94b341adbb7f9fcf4d4","source_locator":"Writing the meta-review > contribution types","text":"consider the Contribution Types chosen by the authors in your meta-review"},{"capture_end_byte":478,"capture_occurrence":1,"capture_start_byte":402,"excerpt_id":"comments-over-scores","sha256":"7a73d08e88e3d7a137133a080d6396af3e68311024819e0204d1ae74e74c96dd","source_locator":"Writing the meta-review > scores and comments","text":"Don't focus too much on the scores. Instead, look carefully at the comments."},{"capture_end_byte":620,"capture_occurrence":1,"capture_start_byte":480,"excerpt_id":"confidence-over-personality","sha256":"14e73f7db00851b37766893e4606ab83aad28fb9b088a8f88c22eb28089b850d","source_locator":"Writing the meta-review > reviewer confidence","text":"Judge the quality of the review rather than taking note of the reviewer's confidence score; the latter may be more a measure of personality."}]}],"source_id":"eccv-2026-ac-guidelines","title":"ECCV 2026 Area Chair Guidelines","url":"https://eccv.ecva.net/Conferences/2026/ACGuideLines"}
