{"capture_locator":"venues/source-captures/eccv-2026-reviewer-guide.json","capture_sha256":"14f2ff9bf4726547081da9c4c8f6c5b88654ed0b450562830e88b55cc3c0b0a0","retrieved_at":"2026-07-28T07:56:49Z","schema_version":"1.0.0","sections":[{"claims":[{"claim_id":"eccv-2026-main:criterion:sound-contribution","claim_kind":"criterion","excerpt_ids":["sound-contribution","knowledge-advancement","sota-not-automatic","novelty-impact-performance","minor-flaws"],"projection":{"rule_id":"sound-contribution","statement":"Assess technical soundness and meaningful knowledge advancement while avoiding automatic rejection for small repairable issues or absence of state-of-the-art performance."},"projection_basis":"source_bounded_interpretation","support_terms":["sound","contribution"]}],"extracted_fact":"ECCV asks reviewers to assess technical soundness and contribution while balancing novelty, impact and performance and not rejecting for easily corrected minor flaws.","section_anchor":"reviewer-guidelines","source_verification":{"method":"manual_browser_text_comparison","offline_nonclaim":"does_not_attest_live_official_page_truth","semantic_projection_review":"human_release_reviewed","status":"verified","verified_at":"2026-07-28T07:56:49Z"},"verbatim_excerpts":[{"capture_end_byte":54,"capture_occurrence":1,"capture_start_byte":0,"excerpt_id":"sound-contribution","sha256":"ad2f03a12bd2164c4b0437b08ed1b120276ce5c71b0672049b2d47ad358228a4","source_locator":"Reviewing In a Nutshell > soundness and contribution","text":"technically sound and make a contribution to the field"},{"capture_end_byte":150,"capture_occurrence":1,"capture_start_byte":56,"excerpt_id":"knowledge-advancement","sha256":"1d260e7f036143c696728bc1da93dc5a91cf47465e906c052df7e2045e6928a2","source_locator":"Reviewing In a Nutshell > knowledge advancement","text":"Look for what is good or stimulating in the paper, and what knowledge advancement it has made."},{"capture_end_byte":269,"capture_occurrence":1,"capture_start_byte":152,"excerpt_id":"sota-not-automatic","sha256":"1ad803f6cee13a6768b001ab0a5dae8d55d7c55f12d3c707285a05884b09a9c4","source_locator":"Reviewing In a Nutshell > state of the art","text":"does not exceed the state-of-the-art accuracy on an existing benchmark dataset is not grounds for rejection by itself"},{"capture_end_byte":361,"capture_occurrence":1,"capture_start_byte":271,"excerpt_id":"novelty-impact-performance","sha256":"f5ff20fb5c1482f058a29e045befbe4f3719a4346f39b21da50a0e30a7a76f51","source_locator":"Reviewing In a Nutshell > balance","text":"weigh both the novelty and potential impact of the work alongside the reported performance"},{"capture_end_byte":445,"capture_occurrence":1,"capture_start_byte":363,"excerpt_id":"minor-flaws","sha256":"6654d74ba2e69847d9540002f5a0c9a45b2df38fc6dc4b98410518d2c8327b1c","source_locator":"Reviewing In a Nutshell > minor flaws","text":"Minor flaws that can be easily corrected should not be a reason to reject a paper."}]}],"source_id":"eccv-2026-reviewer-guide","title":"ECCV 2026 Reviewer Guidelines","url":"https://eccv.ecva.net/Conferences/2026/ReviewerGuide"}
