{"capture_locator":"venues/source-captures/cvpr-2026-ac-guidelines.json","capture_sha256":"6c5c46c7269d39fba273c0cff5bdc51d7efbfe2f56f2ea490d3c39294d4f3193","retrieved_at":"2026-07-28T07:56:49Z","schema_version":"1.0.0","sections":[{"claims":[{"claim_id":"cvpr-2026-main:criterion:meta-review-evidence","claim_kind":"criterion","excerpt_ids":["meta-review-contribution","meta-review-initial-assessment","meta-review-rebuttal","meta-review-final-reasons","meta-review-rationale"],"projection":{"rule_id":"meta-review-evidence","statement":"Summarize the contribution, reviewer assessments, rebuttal, final reviewer reasons, and the AC recommendation with its rationale."},"projection_basis":"source_bounded_interpretation","support_terms":["meta-review","recommendation"]},{"claim_id":"cvpr-2026-main:native_field:meta-review","claim_kind":"native_field","excerpt_ids":["meta-review-contribution","meta-review-initial-assessment","meta-review-rebuttal","meta-review-final-reasons","meta-review-rationale"],"projection":{"allowed_labels":[],"anchors":[],"direction":"not_applicable","field_id":"meta-review","field_type":"text","maximum":null,"minimum":null,"role":"meta_reviewer"},"projection_basis":"source_bounded_native_semantics","support_terms":["meta-review","review"]}],"extracted_fact":"A CVPR meta-review links the contribution, reviewer assessment, rebuttal, final reviewer reasons and AC recommendation with an explicit rationale.","section_anchor":"meta-review","source_verification":{"method":"manual_browser_text_comparison","offline_nonclaim":"does_not_attest_live_official_page_truth","semantic_projection_review":"human_release_reviewed","status":"verified","verified_at":"2026-07-28T07:56:49Z"},"verbatim_excerpts":[{"capture_end_byte":56,"capture_occurrence":1,"capture_start_byte":0,"excerpt_id":"meta-review-contribution","sha256":"010a5bf60ca203a56a08adb599466c4cced683b22e67809b5b6f64927b66d129","source_locator":"Main Tasks > Meta review due","text":"A good meta-review summarizes the paper’s contribution"},{"capture_end_byte":123,"capture_occurrence":1,"capture_start_byte":58,"excerpt_id":"meta-review-initial-assessment","sha256":"a23bae73ff75d335c1351e2b82dc9893cf8adaa1cb3fe5e3515e5aa1e0371e4c","source_locator":"Main Tasks > Meta review due > initial assessment","text":"highlights the main points of the reviewers’ initial assessment"},{"capture_end_byte":164,"capture_occurrence":1,"capture_start_byte":125,"excerpt_id":"meta-review-rebuttal","sha256":"d43a8c801e9226ba2f1b440eec13c5dea9a96185fa42700c80afc7f6ada14aa4","source_locator":"Main Tasks > Meta review due > rebuttal","text":"discusses the arguments of the rebuttal"},{"capture_end_byte":231,"capture_occurrence":1,"capture_start_byte":166,"excerpt_id":"meta-review-final-reasons","sha256":"b49d7997dded8660c083f1f911eeb1ed551aaf499befdee0169c83ff4cb00bcd","source_locator":"Main Tasks > Meta review due > final reviewer reasons","text":"summarizes the reviewers’ reason for their final recommendation"},{"capture_end_byte":305,"capture_occurrence":1,"capture_start_byte":233,"excerpt_id":"meta-review-rationale","sha256":"d04af3fafc2d0d4f1a38e91f25bb8ab3e3f9d5d90e15166c98ca2de7d3cc8e48","source_locator":"Main Tasks > Meta review due > conclusion","text":"concludes with the recommendation of the AC and its underlying rationale"}]}],"source_id":"cvpr-2026-ac-guidelines","title":"CVPR 2026 Area Chair Guidelines","url":"https://cvpr.thecvf.com/Conferences/2026/ACGuides"}
