{"capture_locator":"venues/source-captures/cvpr-2026-training.json","capture_sha256":"707da64ea5a5aebecadc1b5d5f2fdcea4dcd2fe411b0cb44922ed0d058a85357","retrieved_at":"2026-07-28T07:56:49Z","schema_version":"1.0.0","sections":[{"claims":[{"claim_id":"cvpr-2026-main:native_field:rating-and-justification","claim_kind":"native_field","excerpt_ids":["rating-justification"],"projection":{"allowed_labels":[],"anchors":[],"direction":"not_applicable","field_id":"rating-and-justification","field_type":"text","maximum":null,"minimum":null,"role":"reviewer"},"projection_basis":"source_bounded_native_semantics","support_terms":["rating","just"]}],"extracted_fact":"CVPR reviewer training asks for a justified recommendation that connects the assessment to the rating.","section_anchor":"review-content","source_verification":{"method":"manual_browser_text_comparison","offline_nonclaim":"does_not_attest_live_official_page_truth","semantic_projection_review":"human_release_reviewed","status":"verified","verified_at":"2026-07-28T07:56:49Z"},"verbatim_excerpts":[{"capture_end_byte":76,"capture_occurrence":1,"capture_start_byte":0,"excerpt_id":"rating-justification","sha256":"b1e9788213fa74829301427d1b43180af88d564a8199f2a829686c76c4e8b778","source_locator":"Review Workflow > Step 3 > review content","text":"Justified recommendation (clearly connecting your assessment to your rating)"}]},{"claims":[{"claim_id":"cvpr-2026-main:native_field:final-justification","claim_kind":"native_field","excerpt_ids":["final-justification"],"projection":{"allowed_labels":[],"anchors":[],"direction":"not_applicable","field_id":"final-justification","field_type":"text","maximum":null,"minimum":null,"role":"reviewer"},"projection_basis":"source_bounded_native_semantics","support_terms":["final","justification"]}],"extracted_fact":"The final reviewer justification is specific, evidence based, and connected to the final rating.","section_anchor":"finalization","source_verification":{"method":"manual_browser_text_comparison","offline_nonclaim":"does_not_attest_live_official_page_truth","semantic_projection_review":"human_release_reviewed","status":"verified","verified_at":"2026-07-28T07:56:49Z"},"verbatim_excerpts":[{"capture_end_byte":175,"capture_occurrence":1,"capture_start_byte":78,"excerpt_id":"final-justification","sha256":"0e63f56e64dbb7755687fb0172e97a8fd82e4cab797290d19bb520f57a5c105a","source_locator":"Review Workflow > Step 5 > Finalization","text":"Your final justification should be specific, evidence-based, and clearly connected to your rating"}]}],"source_id":"cvpr-2026-training","title":"CVPR 2026 Reviewer Training Material","url":"https://cvpr.thecvf.com/Conferences/2026/ReviewerTrainingMaterial"}
