{"capture_locator":"venues/source-captures/tmlr-ae-guide.json","capture_sha256":"1125227bf5affce57f7a6473c4f321c2ffffd84c9e24f13e8bf21a7df3a3e354","retrieved_at":"2026-07-28T07:56:49Z","schema_version":"1.0.0","sections":[{"claims":[{"claim_id":"tmlr-current-general:native_field:action-editor-decision","claim_kind":"native_field","excerpt_ids":["ae-outcome-labels"],"projection":{"allowed_labels":["Accept","Accept with minor revision","Reject"],"anchors":[{"label":"Accept","value":"Accept"},{"label":"Accept with minor revision","value":"Accept with minor revision"},{"label":"Reject","value":"Reject"}],"direction":"not_ordered","field_id":"action-editor-decision","field_type":"categorical","maximum":null,"minimum":null,"role":"meta_reviewer"},"projection_basis":"source_bounded_native_semantics","support_terms":["accept","reject"]}],"extracted_fact":"The TMLR Action Editor outcome is one of three categorical decisions after the review discussion.","section_anchor":"action-editor-outcomes","source_verification":{"method":"manual_browser_text_comparison","offline_nonclaim":"does_not_attest_live_official_page_truth","semantic_projection_review":"human_release_reviewed","status":"verified","verified_at":"2026-07-28T07:56:49Z"},"verbatim_excerpts":[{"capture_end_byte":76,"capture_occurrence":1,"capture_start_byte":0,"excerpt_id":"ae-outcome-labels","sha256":"fdddb717790812b9c63257785d670e5525f4bef6874fdfe86fd65a40002df9fe","source_locator":"Action Editor Responsibilities > Decision and certification","text":"There are 3 possible outcomes: Accept, Accept with minor revision and Reject"}]}],"source_id":"tmlr-ae-guide","title":"TMLR Action Editor Guide","url":"https://jmlr.org/tmlr/ae-guide.html"}
