{"capture_locator":"venues/source-captures/icml-2026-ac-instructions.json","capture_sha256":"2406c377bb3841e9224e718d4e2bac804ae1d5fb6076d8e2450788e94b52702c","retrieved_at":"2026-07-28T07:56:49Z","schema_version":"1.0.0","sections":[{"claims":[{"claim_id":"icml-2026-main:native_field:meta-review","claim_kind":"native_field","excerpt_ids":["meta-review-reasons","not-average-scores","rebuttal-incorporation","discussion-contradictions"],"projection":{"allowed_labels":[],"anchors":[],"direction":"not_applicable","field_id":"meta-review","field_type":"text","maximum":null,"minimum":null,"role":"meta_reviewer"},"projection_basis":"source_bounded_native_semantics","support_terms":["meta-review","review"]}],"extracted_fact":"ICML Area Chairs base informed meta-reviews on reviews and discussion rather than numerical-score aggregation.","section_anchor":"meta-reviews","source_verification":{"method":"manual_browser_text_comparison","offline_nonclaim":"does_not_attest_live_official_page_truth","semantic_projection_review":"human_release_reviewed","status":"verified","verified_at":"2026-07-28T07:56:49Z"},"verbatim_excerpts":[{"capture_end_byte":165,"capture_occurrence":1,"capture_start_byte":0,"excerpt_id":"meta-review-reasons","sha256":"587341c510da2152709e6e3e34537e928ac0d36f7ecc00d00e9863de7577fdf8","source_locator":"Meta-Reviews > recommendation reasons","text":"Each meta-review should summarize the key points that justify your accept/reject recommendation, whether from the reviews themselves or the (anonymized) discussions."},{"capture_end_byte":323,"capture_occurrence":1,"capture_start_byte":167,"excerpt_id":"not-average-scores","sha256":"ef7f72e808af211e00371a3af3d3c13d4db22eca5f5c57aec2df1614f2868ed8","source_locator":"Meta-Reviews > evidence basis","text":"Your recommendations and meta-reviews should be informed by the review content, as opposed to just relying on average (or other aggregate) numerical scores."},{"capture_end_byte":529,"capture_occurrence":1,"capture_start_byte":325,"excerpt_id":"rebuttal-incorporation","sha256":"64e27374487bb278ae241f5a4dfc98e77a325b1c05cab5c1e1389e34d1a0ef01","source_locator":"Best Practices for Writing Meta-Reviews > rebuttals and comments","text":"If authors raised concerns about poor quality of reviews and/or disengaged reviewers, please assure them that you as an AC have read their rebuttals/comments and incorporated them in your decision making."},{"capture_end_byte":636,"capture_occurrence":1,"capture_start_byte":531,"excerpt_id":"discussion-contradictions","sha256":"91edae5e81a70eaf4e922366891da3d57a7516ecfd4c1ccf899dca06883fba2c","source_locator":"Discussions > contradictions and unclear aspects","text":"important contradictions between reviews, or if any key aspects of the paper remain unclear to a reviewer"}]}],"source_id":"icml-2026-ac-instructions","title":"ICML 2026 Area Chair Instructions","url":"https://icml.cc/Conferences/2026/AreaChairInstructions"}
