{"capture_locator":"venues/source-captures/tmlr-acceptance-criteria.json","capture_sha256":"e8c204671897203c6c305dcb35ca64a5112916696ab9c257bddc1f0476f16557","retrieved_at":"2026-07-28T07:56:49Z","schema_version":"1.0.0","sections":[{"claims":[{"claim_id":"tmlr-current-general:criterion:claims-supported","claim_kind":"criterion","excerpt_ids":["claims-question","more-evidence-route","narrower-claims-route"],"projection":{"rule_id":"claims-supported","statement":"Assess whether the main claims are supported by accurate, convincing, and clearly presented evidence; additional evidence or narrower claims are both legitimate closure routes."},"projection_basis":"source_bounded_interpretation","support_terms":["claims","evidence"]},{"claim_id":"tmlr-current-general:criterion:audience-interest","claim_kind":"criterion","excerpt_ids":["interest-question","no-sota-gate","no-novelty-gate","impact-certifications"],"projection":{"rule_id":"audience-interest","statement":"Assess whether some individuals in TMLR's audience would be interested in the findings; do not substitute novelty, state-of-the-art performance, or predicted impact as independent acceptance gates."},"projection_basis":"source_bounded_interpretation","support_terms":["audience","interested"]}],"extracted_fact":"TMLR acceptance asks whether claims have accurate, convincing and clear support and whether some readers would find the findings interesting.","section_anchor":"acceptance-criteria","source_verification":{"method":"manual_browser_text_comparison","offline_nonclaim":"does_not_attest_live_official_page_truth","semantic_projection_review":"human_release_reviewed","status":"verified","verified_at":"2026-07-28T07:56:49Z"},"verbatim_excerpts":[{"capture_end_byte":91,"capture_occurrence":1,"capture_start_byte":0,"excerpt_id":"claims-question","sha256":"ed5ba8147da9d6f235a145eed571dc768734dd081805c1bbc014cade280e6b1a","source_locator":"Acceptance Criteria > first question","text":"Are the claims made in the submission supported by accurate, convincing and clear evidence?"},{"capture_end_byte":197,"capture_occurrence":1,"capture_start_byte":93,"excerpt_id":"more-evidence-route","sha256":"9af0c4411f577637e0b8b6326c74f81319872a287973ffe74e6fcb1442e074d7","source_locator":"Acceptance Criteria > first question > additional evidence route","text":"Often, this will lead reviewers to ask the authors to provide more evidence by running more experiments."},{"capture_end_byte":265,"capture_occurrence":1,"capture_start_byte":199,"excerpt_id":"narrower-claims-route","sha256":"687f2eb3a27fde8ee2ac545eaeb862778cc4c220a2344323f4fe4824150244a1","source_locator":"Acceptance Criteria > first question > closure options","text":"Another is simply for the authors to adjust (reduce) their claims."},{"capture_end_byte":353,"capture_occurrence":1,"capture_start_byte":267,"excerpt_id":"interest-question","sha256":"bdbb931b31cdab28b7f82c243c316bff5bc9ff6d30d213a08118704c8efa53a8","source_locator":"Acceptance Criteria > second question","text":"Would some individuals in TMLR's audience be interested in the findings of this paper?"},{"capture_end_byte":542,"capture_occurrence":1,"capture_start_byte":355,"excerpt_id":"no-sota-gate","sha256":"38f43bdae12c913701bb4711fc72095b11e8fdd22c5de0079215f0b341efb8c4","source_locator":"Acceptance Criteria > second question > significance and SOTA are not gates","text":"Crucially, it should not be used as a reason to reject work that isn't considered “significant” or “impactful” because it isn't achieving a new state-of-the-art on some benchmark."},{"capture_end_byte":715,"capture_occurrence":1,"capture_start_byte":544,"excerpt_id":"no-novelty-gate","sha256":"d0eb6e99b11f74e26eafe0080f8a24042efe8611dce57ac3ef8a094227ff6afc","source_locator":"Acceptance Criteria > second question > novelty is not a gate","text":"Nor should it form the basis for rejecting work on a method considered not “novel enough”, as novelty of the studied method is not a necessary criteria for acceptance."},{"capture_end_byte":926,"capture_occurrence":1,"capture_start_byte":717,"excerpt_id":"impact-certifications","sha256":"f1a66f70b2e51b913e918efb5384811e541eb21f5b41413e4a64618ab5290741","source_locator":"Acceptance Criteria > second question > significance and impact certifications","text":"TMLR instead relies on certifications (such as “Featured” and “Outstanding”) to provide annotations on submissions that pertain to (more speculative) assertions on significance or potential for impact."}]}],"source_id":"tmlr-acceptance-criteria","title":"TMLR Acceptance Criteria","url":"https://jmlr.org/tmlr/acceptance-criteria.html"}
