{"capture_locator":"venues/source-captures/eccv-2026-contribution-types.json","capture_sha256":"2c1b233deb5f33463bc626388a2f546bf9267571124c53bac7e644ab9e151a8d","retrieved_at":"2026-07-28T07:56:49Z","schema_version":"1.0.0","sections":[{"claims":[{"claim_id":"eccv-2026-main:criterion:contribution-type-lens","claim_kind":"criterion","excerpt_ids":["primary-lens","holistic-assessment","not-rigid-checklist","explicit-reclassification"],"projection":{"rule_id":"contribution-type-lens","statement":"Use the author-selected contribution type as the primary evaluation lens, assess the work holistically rather than as a rigid checklist, and explicitly justify any reclassification."},"projection_basis":"source_bounded_interpretation","support_terms":["contribution","type"]},{"claim_id":"eccv-2026-main:native_field:justification-of-rating","claim_kind":"native_field","excerpt_ids":["justification-of-rating-field"],"projection":{"allowed_labels":[],"anchors":[],"direction":"not_applicable","field_id":"justification-of-rating","field_type":"text","maximum":null,"minimum":null,"role":"reviewer"},"projection_basis":"source_bounded_native_semantics","support_terms":["justification","rating"]}],"extracted_fact":"ECCV contribution types are primary review lenses, not rigid checklists; reviewers assess holistically and explicitly justify any reclassification.","section_anchor":"contribution-type-interpretation","source_verification":{"method":"manual_browser_text_comparison","offline_nonclaim":"does_not_attest_live_official_page_truth","semantic_projection_review":"human_release_reviewed","status":"verified","verified_at":"2026-07-28T07:56:49Z"},"verbatim_excerpts":[{"capture_end_byte":100,"capture_occurrence":1,"capture_start_byte":0,"excerpt_id":"primary-lens","sha256":"c305e11ab35067b6d62d03713eb90ddd139bb951816e85870fc0ad03f4659b3d","source_locator":"On Disagreement with the Selected Contribution Type > primary lens","text":"primarily evaluate each submission through the lens of the contribution type selected by the authors"},{"capture_end_byte":147,"capture_occurrence":1,"capture_start_byte":102,"excerpt_id":"holistic-assessment","sha256":"d7050233877e6854859cc778f73bf092e842ba0b6ef44f82c61266348b9e2e56","source_locator":"Contribution Types > holistic assessment","text":"reviewers should assess the work holistically"},{"capture_end_byte":173,"capture_occurrence":1,"capture_start_byte":149,"excerpt_id":"not-rigid-checklist","sha256":"87673540308cab007accd1b161ef7e4f8722c74267e9caeec248d89d059b6a90","source_locator":"Algorithms / General > criteria reminder","text":"not as a rigid checklist"},{"capture_end_byte":251,"capture_occurrence":1,"capture_start_byte":175,"excerpt_id":"explicit-reclassification","sha256":"36831833e9616292995b2c5344f8c46be2b43d53867bb1b7e35e81310a5fe854","source_locator":"On Disagreement with the Selected Contribution Type > explicit justification","text":"only if this decision is made explicit and carefully justified in the review"},{"capture_end_byte":358,"capture_occurrence":1,"capture_start_byte":253,"excerpt_id":"justification-of-rating-field","sha256":"21c510b73be7ba28b6d9821449acc76b922564c5a8d80ee30f0d64f18d946023","source_locator":"On Disagreement with the Selected Contribution Type > Justification of Rating","text":"This justification should be stated explicitly in the “Justification of Rating” section of the review"}]}],"source_id":"eccv-2026-contribution-types","title":"ECCV 2026 Guidance on Contribution Types","url":"https://eccv.ecva.net/Conferences/2026/ReviewerContributionTypes"}
